[
  {
    "incident_id": "INC-0003",
    "report": "Pressure reading fell to zero while a redundant mechanical gauge remained stable at 120 psi. Sensor wiring was loose at the connector.",
    "component": "pressure_sensor",
    "failure_mode": "signal_loss",
    "severity": "medium",
    "urgency": "within_24_hours",
    "probable_cause": "loose sensor connector",
    "evidence": [
      "electronic reading fell to zero",
      "mechanical gauge remained at 120 psi",
      "sensor wiring was loose"
    ],
    "recommended_action": "secure the connector and verify sensor output",
    "confidence": 0.99,
    "abstain": false,
    "requires_human_review": false,
    "review_notes": "Instrumentation fault, not actual pressure loss."
  }
]
